ID,Title,Body,Image,Geo,UID
region_1,Worldwide,"Content is related to the whole globe",1_worldwide.png,Worldwide,user_1
region_2,Africa,"Africa is the world's second-largest and second-most-populous continent. At about 30.2 million km2 (11.7 million sq mi) including adjacent islands, it covers six percent of the Earth's total surface area and 20.4 percent of the total land area. With 1.1 billion people as of 2013, it accounts for about 15% of the world's human population. The continent is surrounded by the Mediterranean Sea to the north, both the Suez Canal and the Red Sea along the Sinai Peninsula to the northeast, the Indian Ocean to the southeast, and the Atlantic Ocean to the west. The continent includes Madagascar and various archipelagos. It has 54 fully recognized sovereign states (countries), nine territories and two de facto independent states with limited or no recognition.",2_africa.png,Africa,user_1
region_3,Latin America & Caribbean,"Latin America is the subregion of the Americas comprising those countries where Romance languages are spoken, primarily Spanish and Portuguese. It consists of twenty sovereign states which cover an area that stretches from the southern border of the United States to the southern tip of South America, including the Caribbean. Latin America has an area of approximately 19,197,000 km2 (7,412,000 sq mi), almost 13% of the earth's land surface area.",3_latin_caribbean.png,Latin America & Caribbean,user_1
region_4,Asia,"Asia is the Earth's largest and most populous continent, located primarily in the eastern and northern hemispheres. Though it covers only 8.7% of the Earth's total surface area, it comprises 30% of earth's land area, and has historically been home to the bulk of the planet's human population (currently roughly 60%). Asia is notable for not only overall large size and population, but unusually dense and large settlements as well as vast barely populated regions within the continent of 4.4 billion people. Asia has exhibited economic dynamism (particularly East Asia) as well as robust population growth during the 20th century, but overall population growth has since fallen to world average levels.",4_asia.png,Asia,user_1
region_5,Europe & Russia,"<p>Europe is a continent that comprises the westernmost peninsula of Eurasia. It is generally divided from Asia by the watershed divides of the Ural and Caucasus Mountains, the Ural River, the Caspian and Black Seas, and the waterways connecting the Black and Aegean Seas.</p><p>European Russia (also Western Russia or Central Russia) refers to the Western areas of Russia that lie within Europe, comprising roughly 3,960,000 square kilometres (1,528,560 mi2) and spanning across 38% of Europe. Its eastern border is defined by the Ural Mountains and in the south, it is defined by the border with Kazakhstan. This area includes Moscow and Saint Petersburg, the two largest cities in Russia.</p>",5_europe.png,Europe & Russia,user_1
region_6,Oceania & Pacific,"Oceania also known as Oceanica, is a region centred on the islands of the tropical Pacific Ocean. Opinions of what constitutes Oceania range from its three subregions of Melanesia, Micronesia, and Polynesia to, more broadly, the entire insular region between Asia and the Americas, including Australasia and the Malay Archipelago",6_oceania.png,Oceania & Pacific,user_1
region_7,Northern America,"Northern America is the northernmost region of the Americas, and is part of the North American continent. It lies directly north of the region of Middle America; the land border between the two regions coincides with the border between the United States and Mexico.",7_northern_america.png,Northern America,user_1
region_8,Other Regions & Classifications,"Other geographical terms used to group countries.",1_worldwide.png,Other Regions & Classifications,user_1