ID,Parent,Status,NID,UID,Body
ca_1,,1,article_1,user_4,"Lorem ipsum dolor sit amet, consectetuer adipiscing elit. Aenean commodo ligula eget dolor. Aenean massa. Cum sociis natoque penatibus et magnis dis parturient montes, nascetur ridiculus mus. Donec quam felis, ultricies nec, pellentesque eu, pretium quis, sem. Nulla consequat massa quis enim. Donec pede justo, fringilla vel, aliquet nec, vulputate eget, arcu. In enim justo, rhoncus ut, imperdiet a, venenatis vitae, justo. Nullam dictum felis eu pede mollis pretium. Integer tincidunt. Cras dapibus. Vivamus elementum semper nisi. Aenean vulputate eleifend tellus. Aenean leo ligula, porttitor eu, consequat vitae, eleifend ac, enim. Aliquam lorem ante, dapibus in, viverra quis, feugiat a, tellus. Phasellus viverra nulla ut metus varius laoreet. Quisque rutrum. Aenean imperdiet. Etiam ultricies nisi vel augue. Curabitur ullamcorper ultricies nisi. Nam eget dui."
ca_1_1,ca_1,1,article_1,user_2,"I don't know what you are talking about"
ca_1_1_1,ca_1_1,1,article_1,user_5,"I was just testing the comment functionality"
ca_1_1_1_1,ca_1_1_1,1,article_1,user_4,"Oh, seems to work then"
ca_1_1_1_2,ca_1_1_1,1,article_1,user_2,"Test successful."
ca_1_1_1_2_1,ca_1_1_1_2,1,article_1,user_2,"Test 1,2,3"
ca_1_1_1_1_1,ca_1_1_1_1,1,article_1,user_2,"Test 0,1,2"
ca_1_2,ca_1,1,article_1,user_6,"Bacon ipsum dolor sit amet tri-tip ribeye bacon frankfurter. Landjaeger tenderloin capicola short ribs, pork chop flank fatback. Spare ribs drumstick pork chop turducken kielbasa landjaeger rump short loin. Ham hock bresaola doner capicola, frankfurter filet mignon ground round short ribs. Short loin pork chop pork belly, pork pancetta tongue porchetta venison ribeye pork loin tenderloin turkey tail sausage chicken."
